肖申克的救赎,9.7,1908418人评价,https://movie.douban.com/subject/1292052/,不需要女主角的好电影,恐惧让你沦为囚犯，希望让你重获自由。——《肖申克的救赎》,策划了19年的私奔……,有种鸟是关不住的.,因为1994年台湾引进了一部比较卖座的老片The Sting，被错译成了《刺激》。到了1995年本片上映时，片商觉得其剧情与《刺激》有类似的地方（大概都属于高智商的复仇？），因此被译成了《刺激1995》，1998年又有一部片子Return To Paradise因为含有牢狱情节，被译成《刺激1998》！
霸王别姬,9.6,1403527人评价,https://movie.douban.com/subject/1291546/,在野路子出身的张国荣面前，学院出身的张丰毅显得那么单薄,说好了一辈子，少一年、一天、一个时辰，都不是一辈子。,他竟当面一语点破：虞姬是真虞姬，霸王是假霸王。,这真的不是电影，而是人生。如此真实深刻地反映了从抗战前夕至文革的那段历史时期下命运凄惨的人们，渗透在每一个细节，包括那个不能忍受戏班虐打的孩子，而文革中六亲不认，人格扭曲更是展现到了极致。当然最赞的是哥哥的表演，如此悲哀可怜的蝶衣让人心痛，不疯魔不成活，人戏不分，现实的他也是如此,你凝视你的脸，几亿人在爱恋。
阿甘正传,9.5,1451202人评价,https://movie.douban.com/subject/1292720/,阿甘奔跑的意象，应该留在了很多人心里。,Mama always said life was like a box of chocolates. You never know what you're gonna get.,太甜美的美國夢,重新再看一遍，觉得奥斯卡当年颁给《阿甘正传》而不是《肖申克的救赎》，还是对的……更广阔，经得起各种解读，每个人都能找到自己的点。,"十年前看过一遍，那时还是一个小屁孩，就像Forrest的妈妈说的一样，生活就像一盒巧克力，十年前的我绝对不会预料得到现在我会成为一个这样的大男生。Forrest Gump真是把""蠢萌""这两个字发挥到极致，我的意思是，蠢萌，其实也是上帝给予的天赋。"
这个杀手不太冷,9.4,1647158人评价,https://movie.douban.com/subject/1295644/,我开始想要过得快乐，睡在床上，有牵挂,我没啥感觉的公认好片。,或许是很多姑娘大叔控的根源。,"Léon： You're not going to lose me. You've given me a taste for life. I wanna be happy. Sleep in a bed, have roots. And you'll never be alone again, Mathilda. Please, go now, baby, go. Calm down, go no...","Here in my stomach. It's all warm. I always had a knot there, and now.. it's gone."
美丽人生,9.5,921323人评价,https://movie.douban.com/subject/1292063/,很久以前看过的，永远难忘片中父亲的鬼脸,父爱构筑了一场温馨的战争，没有在孩子心里留下任何阴影。故事分裂成两部分，前半是圭多对公主的追逐，用智慧战胜了强大的求婚者，抱得美人归；后半是战争风雨飘摇时对亲情的忠诚，在迈开大正步赴死，努力保护孩子时，父爱如山，界已成神.,这是父亲所作的牺牲，这是父亲赐我的恩典。★★★★☆,前后如同两部电影。前一半有多欢脱，后一半就有多苍凉。我特别在意那位执着与于猜谜的军官，善与恶，竟然最终抵不过一道谜题，这也是一种人生的况味吧。,"世界上最美丽的谎言与微笑。Surprise her, forever!"
泰坦尼克号,9.4,1396592人评价,https://movie.douban.com/subject/1292722/,那对对死无所畏惧的老夫妇，那个不为外界干扰的乐队，那个为生而做一次假父亲的男人，那个为爱人吹响口哨的女人。都是为了一种心灵上的执着。,永远是我在电影院所看过最好的电影,还是会哭。,"生死两茫茫
不思量
自难忘",学校组织放映的影片，大家好像对rose和jack恋爱过程猎奇，但是让我感动的一幕是轮船将要沉沦，海上乐队的绅士们整理领结，肃穆庄严的弹奏最后一曲，那一瞬间，仿佛听见一首镇魂曲在响彻。
千与千寻,9.3,1491877人评价,https://movie.douban.com/subject/1291561/,"每次看这些神作的时候想到这是动画片这是一群牛人一笔一笔画出来的,就觉得漏看掉一帧都实在是对不起他们啊",最好的宫崎骏，最好的久石让。,“有些事情是不可能忘记的。 只是一时想不起来。”忘了怎么打动我的了……好像不是打动，而是震撼。,"你忘了吗?
往下飞的时候眼泪是往上流的.",我觉得这部电影激发了我对日本动画的兴趣……预言难以表述我的感受，怪诞，温暖，治愈……总之，这是我这辈子看过的最好的动画（为什么我现在才看！）
辛德勒的名单,9.5,742659人评价,https://movie.douban.com/subject/1295124/,有钱才能保护喜欢的人,印象很深刻的是黑白画面中的红色。,出门的时候，看到灯火辉煌的城市，会觉得一切幸福美好都是罪恶。。。,请看一部没有笑容的电影吧,很棒，直击人心。不知道什么时候中国也能拍出这样的电影。
盗梦空间,9.3,1400182人评价,https://movie.douban.com/subject/3541415/,1、电影确实精彩。2、没有想象的难懂，相信你自己。3、总会有一个让你记一辈子的镜头。4、请降低期待值。5、请提前上厕所。6、记得关手机。7、一定要去影院，因为影院也是个造梦机器。8、记得听完结尾音乐。因为它负责让你醒来。9、极可能是近几年你在影院看过最精彩的电影。10、穿越吧少年,“既然做梦，就做大点” 这句太深得人心了。——2010年最天才的电影。“谁又能说，现实不是梦境。” Do you remember how you got here?,这电影看完就开始怀疑人生了，类似的还有《蝴蝶效应》《骇客帝国》《心慌方》《无姓之人》《攻壳机动队》《楚门的世界》等等……其实我突然觉得这一类题材影片的鼻祖明明就是动画片《魔方大厦》啊，郑渊洁威武。,前期的口碑营销确实有点儿过了，绝对还没有达到神作的级别，但依旧是近年来最好的影片，诺兰独有的叙事技巧视觉风格以及影像语言都被完美的贯彻其中，其遵循并热爱的怀古之风从人物造型，台词蔓延到拍摄手法以及特效制作上，不过正因为如此，一些动作戏上的处理还有视觉奇观的展现则还不是那么过瘾。,概念不算新鲜但还不错 ;p 充斥许多漂亮的慢动作镜头和带点匪夷所思的建筑构想，视觉效果挺棒的！偶尔会令我想起Paprika……
忠犬八公的故事,9.4,961977人评价,https://movie.douban.com/subject/3011091/,"你要养狗,就不能当它是guest,十年可是一只狗的一辈子",“永远都不能忘记你所爱的人” 狗尚如此，人何以堪？5星给动情的真实故事。,"哭死啦...想去涉谷看看那尊雕像...by the way,那个帅老头我好喜欢...!!!",“等有一天它会给你捡球的时候，一定有什么特殊的理由” 八公用这种方式来告别了他的主人....,这次不是拉布拉多，不是金毛，是默默无闻的秋田犬~在电影的最后部分我哭的稀里哗啦，意气风发的八公老了，脏了，以前不怎么喜欢他的女主人抱着它感动的流泪，大雪纷飞的夜里因为有火车来了八公又在等，似乎是回光返照般的看见男主人一如从前那样从火车站里走出来张开双臂要拥抱他~其实狗狗什么都知道
海上钢琴师,9.3,1162426人评价,https://movie.douban.com/subject/1292001/,又是一定该看的，只在自己的世界里坚持自己的人．哪怕生命就这样消逝．只留下一点声音的碎片，１９００，也许我们都一样害怕脚踏实地的生活，害怕乌烟瘴气的世界．,给大众看的艺术家电影，很多煽情与细述很不必要，但是很多人喜欢,我就爱他说，fuck the regulations!!,键盘有始有终，你确切知道 88 个键就在那儿，错不了。它并不是无限的，而你，才是无限的。你能在键盘上表现的音乐是无限的，我喜欢这样，我能轻松应对，而你现在让我走过跳板，走到城市里，等着我的是一个没有尽头的键盘，我又怎能在这样的键盘上弹奏呢？那是上帝的键盘啊！,我想有些东西只是能在特定的环境下生长。当环境变了，其他的一切都会变。
机器人总动员,9.3,923495人评价,https://movie.douban.com/subject/2131459/,浪漫得一塌糊涂，像废墟中开出的花，像牵手散步的下午，像世上所有伟大的爱情。,陈奕迅都为你唱歌了,機器人談戀愛也避免不了男女搭配的窠臼(叫Eva倒有夠諷刺)，就更不用説亙古不變的雙眼雙手擬人造型...人類的想象力其實很貧瘠,到底有多少人是因为《机器人总动员》这个烂译名错过它的！太出色的一部动画了，你找不到替代品的。默片，看似简单又非常复杂的设计，怎么那么棒，那么感人。,Just need someone who will look after you
三傻大闹宝莱坞,9.2,1286874人评价,https://movie.douban.com/subject/3793023/,看了这部电影是我2010年最幸运的一件事 力荐！,太给力了，有史以来最励志的电影。,活在当下，不记得失，以无为之心做有为之事，你收获的会是比物质更珍贵永恒的生命体验。,它又吵又闹、又臭又长，但我想不出什么理由不给它五颗星。,第一次完整看完一部印度片。中国不如。
楚门的世界,9.3,1023055人评价,https://movie.douban.com/subject/1292064/,他用别人的相片拼凑出她的样子， 在这个虚假的，冷漠无情的世界里只有这份思念是唯一的真实,我是不是也在楚门的世界活着？,年轻时候的金凯瑞真TMD 帅。尤其一头柔顺的头发。,换句话说，他的生活就是真实的生活，如果什么也没出现什么也没发现。再换句话说，所有的配角被迫清醒地站在这个虚拟的边缘，吃喝拉撒24小时待命，意识到此刻的高潮被以亿计算的人类消费着，除此之外生活的区别只是没有摄像头对着，不用去区分真或假。精神病和真实一线之隔。坚持到底你就赢了。,神作！！！！！！！！！！！！！！！！！！！！！！！！！！！！！！！！！！！！！！！！！！！！！！！！！！！！！！！！！！！！！！！！！！！！！！！！！！！！！！！！！！！！！！！！！！！！！！！！！！！！！！！！！！！！！！！！！！！！！！！！！！！！！！！！！！！！！！！！！！
放牛班的春天,9.3,895486人评价,https://movie.douban.com/subject/1291549/,纸飞机+挥动的小手——那一刻，什么都值了,歌真好听，为什么我上学内会儿参加合唱队唱的都是《黄河大合唱》之类的,男孩的声音真是好听……,所以我一直坚信最好的教育人才应该放在学前教育和初等教育。小学老师对孩子的未来产生的影响远大于大学老师。可现状却是，大批自己都没学会怎么做人的人被随随便便扔到了小学、初中做老师，放纵霸凌，根据权势财势“因材施教”，惩罚性教育，把孩子逼上绝路就让天性不良背锅，呸。,一位影评人：“不同于一般的运用悲情拼命煽情的悲情电影，或极尽夸张搞怪的爆笑喜剧，《放牛班的春天》是一部让人因为喜悦而泪流满面的电影。这也创造了法国电影新概念——阳光情感电影。这部没有美女、暴力；没有动作、凶杀和商业元素的好电影成为了本年度法国人的心灵鸡汤”
星际穿越,9.3,1035910人评价,https://movie.douban.com/subject/1889243/,时间可以伸缩和折叠，唯独不能倒退。你的鹤发或许是我的童颜，而我一次呼吸能抵过你此生的岁月。,太壮阔了，无以言表！40'渐入佳境，80'叹为观止，120'泪流满面，160'恍如隔世…不曾如此贴近浩瀚星空，被它环抱；不曾如此触摸生命之弦，遁入五维幻境。瑕不掩瑜的科幻神作，刷新视觉的IMAX体验，观影前撒好尿，准备接受近三小时的泪腺洗礼。“爱是一种力量，让我们超越时空感知它的存在”-发自豆瓣App,赶着首映翘课去看了imax版。诺兰一直在围绕人物内心讲故事，配上宇宙孤独梗，目瞪口呆或许是夸张，但泪流满面了几次绝对是事实。很多宇宙中的片段没有背景音乐，全场安静地如梦如幻。影片结束后随着观众鼓了掌，能和这样出色的人类活在同一个时代，的确是我的幸运。 期待影片明年多拿到几个提名,2011年11月有《雨果》，2012年11月有《少年派的奇幻漂流》，2013年11月有《地心引力》，2014年11月有《星际穿越》，……前三部电影分别获得11、10、11项的奥斯卡提名，然后都拿下最佳摄影和最佳视觉效果奖，由此，我们可以预测《星际穿越》2015年的奥斯卡提名数和最佳摄影+视觉效果拿奖的可能性？……,相比诺兰之前的片子，这部显得比较慢热。然而前两段的层层铺垫终于迎来了第三段主题呈现的水银泻地。Inception仅仅一笔带过的亲情成为了这部电影的核心母题。麦康纳和查斯坦的精湛演技，胶片IMAX呈现出的影像质感，实拍特效的震撼人心，平行剪辑的完美流畅，寂寞大叔创造性的管风琴配乐，神一样的诺兰
大话西游之大圣娶亲,9.2,1011289人评价,https://movie.douban.com/subject/1292213/,无论是看第三十遍，还是第三十一遍，我都会对着那个寂寥的背影流泪。那落寞的大圣身上烙印着我青春时所有梦想，我们曾以为自己会成为盖世英雄，以为自己是这个世界的唯一，以为爱情专为自己存在，可是渐渐发现自己和别人没有什么不同，当你踏上社会时，总会有人看着你的背影说：看，他好像条狗啊！,有人跟我比赛背台词么,我猜中了开头，却猜不到这结局。/ 20141024 在影院哭死,一生所爱：我的意中人是个盖世英雄，有一天他会穿着金盔金甲，踩着七色的云彩来娶我。我猜中了前头，可是我猜不着这结局…… ,紫霞飘向太阳时、齐天大圣离开城门时，都哭成了傻逼。有多庆幸能踩着五彩祥云做你的盖世英雄，就有多遗憾没办法与你守护终身。喜欢的是五百年前的晶晶、还是给了自己三颗痣的紫霞；喜欢无拘无束敢爱敢恨的至尊宝、还是套上紧箍咒背影像狗的孙悟空？爱的命题究竟太空泛，恐怕还是要交给月光宝盒。
熔炉,9.3,619990人评价,https://movie.douban.com/subject/5912992/,人口大国什么时候能拍出这样的片子，这样在嘲笑棒子的时候才有点底气。,想起一级恐惧的片头台词来：想找公平就到妓院，想被人干才到法庭。深雾中到处是颤栗的呻吟。,。。。套用 被嫌弃的松子的一生 里面的一句话：生而为人，对不起。,一个文科生，每天背着政治生活，背四项基本原则我国的国体公民的权利。亲眼看着热搜被撤下，视频被删除，三种颜色消失不见。豫章书院还存在，赵V再也没有人提及，国乒事件最后化为一题选择题。熔炉的故事真实发生在我所在的国度。“我们一路奋战，不是为了改变世界，而是为了不让世界改变我们。”,我在想演戏的小孩子会不会有心理阴影
疯狂动物城,9.2,1197626人评价,https://movie.douban.com/subject/25662329/,完爆冰雪超能头脑，动物再次证明了动画片不止是给小朋友看的，而是全年龄段和世界级的，尖端数码特技、新意剧情、老梗新用搭配萌Q画风，乌托励志、搞笑温情、自然销魂、阴谋反转，用动物来映射人类，涉及种族歧视和两党斗争，无论从制作技术还是政治倾向或是社会意义来说，基本锁定今年奥斯卡最佳动画,故事流程对小盆友来说不艰深对大盆友也不无聊。树懒那段，跟法国公务员打过交道的都会心一笑。兔子的微表情做得很棒。然而对所有的群体标签统一嘲讽的结果就是下意识也贴了标签（比如狐狸必然聪明却捞偏门，兔子一定是繁殖癌，猛兽全是雄性，etc）。最后，可惜世界不是一部迪斯尼出品的动画片。,换了新领导就是不一样。迪士尼暗黑大电影，洛杉矶罪案片风格和内核。还真是动物乌托邦，美国针对有色人种，欧洲针对难民，天朝针对公知和五毛吗？人设精彩，细节丰富，但要说创意超《头脑特工队》显然就不实事求是了。,"想嫁给又吊儿郎当又酷得不像话的狐狸先生。
自认为是奥斯卡长篇动画的有力候选。
啊啊啊，真的好好看，我要去二刷。",超~~~~~~~~~~可爱的。大眼睛看得我都化了。一想到未来狐狸跟兔子可能有感情戏，我就hhhhhhhh。那只长耳朵的狐狸和那群二哈狼是我的笑点！！！
无间道,9.2,825604人评价,https://movie.douban.com/subject/1307914/,牛就牛在，他让所有演员都达到了巅峰,刘嘉玲说：当年拍无间道的时候梁朝伟每天只开工三四个点就回家，拍了二十多天就拍完了，之后就是获奖无数。演戏这种事，不得不承认是有天赋的。,重新对香港电影刮目相看，它从哲学的角度深入探索人性，去感受身不由己之下的那种窒息，感受贪婪与自私，体验善恶的痛楚纠结。编剧确实是相当的出色，梁朝伟的陈松仁直接神化，所有的角色都可圈可点，没有一出多余的地方，以至多年后看美版的时候仍然不忘旧爱。这是港片的里程碑。9.2,一气呵成。梁朝伟的眼神令人揪心。,经典港片，无间道，如人生~~
龙猫,9.2,864447人评价,https://movie.douban.com/subject/1291560/,那音乐壮丽的响起的时候，觉得心里被一种温暖充满，然后实在控制不住眼泪了，不是因为伤心，而是因为，它给人的感觉，实在美好到无法表达了．,如果你在下雨天的车站，遇到被淋湿的妖怪，请把雨伞借给它，你会得到森林的通行证哦,这个情节也太简单点了吧……,摸摸龙猫的鼻子胡须就会颤动起来哦=w=……看见斜眼偷瞄逃跑的小白一定要跟上去！ 童话总是在相信它的人心中真实的存在着，想起来的时候心中就会充满温暖守护的力量,宫崎骏真是个内心柔软的天才。能给这个残酷的世界这么多温暖。龙猫真像童年时的一场梦，长大之后似乎忘记了，突然看见它毛茸茸的身躯，就想起了所有的奢望。这大概就是我们得以在孤独中相互告慰的东西吧。无论怎样，成熟都是一场病，而能够治愈它的，大概只有对这个世界最温存的渴望。
教父,9.3,633706人评价,https://movie.douban.com/subject/1291841/,"男人。
千万不要记恨你的对手，这样会让你失去理智。",讲述的是一个好孩子怎么变成老大的过程,科波拉是有厌女症吧？这片子里的女人要么圣母得让人恶心，要么就傻逼得遭人烦，除了哭哭啼啼就是无理取闹。最后一个镜头，麦克成为新的教父，一道门隔开他的妻子，不是没有理由的。这是一个男人的世界。相对来说我最喜欢医院里那场戏，拍得相当有张力，第一场婚礼戏也喜欢。,平缓的节奏蕴藏着巨大的权威和张力，音乐舒缓淡淡忧伤，利益博弈人性冲突。无论是演技还是镜头、音乐的运用，都给人以一种美的享受。而看这部电影是极其需要沉下心来细细品味，也无论何时翻出来重温都能有新的感受。★★★★☆,这男人。。。牛逼又孤独吧。。
当幸福来敲门,9.1,1032159人评价,https://movie.douban.com/subject/1849031/,如果能让自己不再为光阴被虚度，才华被耗尽而流泪，如果能让自己坚定，“我不要似是而非的人生，我要自己做的每一件事都刻骨铭心”，那么这场狂热便是得其所，记住这永远不是最差的人生。,为毛不去天桥上乞讨？为毛不去地铁里乞讨？在我们这儿是这么办的。,"孩子母亲颤抖着说你会照顾好他；
装扮成时光机器来安抚孩子，子夜洗手间中独自哭泣；
“你是个好爸爸”，孩子说。
看电影的时候，我的手经常不自觉的紧握着，为那揪心的困窘。
幸福在这里敲门了，可是那些没有被敲门的人呢？",生活时常会让我们感到艰辛，并会让我们无数次目睹生命在各种重压下的扭曲与变形。——《生命不可承受之轻》,除了幸福 什么都能放弃 一定要幸福 和自己喜欢的人在一起 做自己喜欢的事
怦然心动,9.1,1188360人评价,https://movie.douban.com/subject/3319755/,某山渣树怎么好意思说自己是史上最纯？？！！！！！ 这个真打动我了。。。女孩是第二眼美女！！！！！！！！！！,………………我能給十星嗎！,萌死我算了，男主太帅了吧！,上学的时候早恋，父母反对；上班了不恋爱，父母反对。你真是羡慕人家老外啊。,斯人若彩虹，遇上方知有
触不可及,9.2,674574人评价,https://movie.douban.com/subject/6786002/,对残障人士最大的尊重，就是不要把他们当做残障人士。尊重比爱和同情心更高等级,今年看的第二部佳片。茫茫人海，两个截然不同的人相遇，你改变了我，我改变了你，相逢的人会再相逢。关于社会的贫富差距、青少年犯罪、种族歧视这些虽没有明说却在暗中映射，以此来烘托角色。富豪有钱却残疾不快乐，黑人贫穷却有一颗善良乐观的心。ps:Ludovico Einaudi的配乐很加分！,去年的法国票房冠军，来自于一个真实故事的改编。少有的不刻意煽情，原声很棒，一个老套的故事竟能讲的如此有趣，还总能时不时惹人发笑，让人感动。最后字幕拉起时，仍在回味并享受那种喋喋不休与法式优雅情怀。有时，也许你给我的，是所有人都无法触及到的。★★★★,但你们真的好容易被感动哦。,就像Ludovico Einaudi的钢琴配乐，古典，氛围，轻易就可以打动人心，我对于此人的印象，还停留在【这就是英格兰】电影原声阶段。欢乐和温情并存的法式温情喜剧，台词很精准，刻画人物的同时还让人捧腹，力道精准，火候尚佳，这应该就是点到即止的魅力！高雅和喜剧细胞还真不是随便就能学来的。★★★★
蝙蝠侠：黑暗骑士,9.2,694892人评价,https://movie.douban.com/subject/1851857/,大片中很有内涵的一部，不管是人们心中暗自涌动的对小丑疯狂灭世主义的不安的共鸣，还是对蝙蝠侠孤独暗夜行走的英雄惜英雄般同情，其实都是人们对这个世界失望的一种情绪释放。其实小丑说的很对，他和蝙蝠侠很像，都是异类，只不过蝙蝠侠把痛苦留给自己，顽固地去坚守一丝信仰，而小丑把痛苦还给世界。,Christopher Nolan太厉害了，好莱坞漫画类型片居然能拍到这样的高度...,对于这么优秀的电影来说，再多的赞美都是多余的。,“有些人并不喜欢那些常人偏爱的东西，比如金钱，他们不被收买、不会被恐吓、不可理喻、更不接受谈判，有些人就想看人间地狱。” 也只有蝙蝠侠，才能让小丑变得完整。无尽的黑暗。,当之无愧最出色的商业电影！
控方证人,9.6,260547人评价,https://movie.douban.com/subject/1296141/,"无论是剧本、导演还是个人表演，几乎都无可挑剔。机智的台词和精彩的法庭辩论，十足精彩！即便在结局前猜到了最终结果也并不会让电影在精彩程度上有丝毫削减。btw,电影最后提示请勿剧透我还真是头一会见。★★★★☆",律师三寸舌，妇人宫心计，两者皆不敌，最坏男人心，花心郎算尽太聪明，反算了戚戚性命,诙谐的对白，严谨的思路，一心要把观众往沟里带的情节。ps:我觉得那个女仆的表演也很不错！,抱着对法庭题材的偏见去看，没想到竟是一部够回味好几天的片子，不仅仅因为惊艳的结尾，整部戏就像让观者身临其境一样，思其所思、忧其所忧，黑洞一样的剧情吸引着人，最后把你完全裹住、迅速吞噬。演技、导演、编剧真是惊为天人。第一部怀德片。,演的不错，但是结局也没有说的那么玄乎吧？多读几本阿婆的书，这样的结局还不是手到擒来。 
活着,9.2,536346人评价,https://movie.douban.com/subject/1292365/,"活着就是受罪 活着就是劳累 
活着就是互相折磨 活着就是不对 
活着就是受罪 活着就是劳累 
活着还得互相安慰 活着就会憔悴 
活着就是受罪 活着就是劳累 
活着就得拼命挣扎 活着就得干脆
——尹吾 你笑着流出了泪",演员选得很好，巩俐演啥像啥。但整体没有小说感人，可能小说太残酷了吧。兴，百姓苦；亡，百姓苦。活到最后的人，往往最痛苦。,个人认为张艺谋最好的电影，可惜这样的电影被当局禁了，因为固有的自卑。9分,高度不及小说 煽情也不如 Btw，看不出为什么要禁映  2002，11,从一开始不可能让人哭，我就哭得一塌糊涂，因为这部片，又不全是。
