玛丽和马克思,8.9,319871人评价,https://movie.douban.com/subject/3072124/,伤心电影，好电影。结尾告诉我们，网友见面要早。,个人认为影片比《飞屋环游记》要出色,"PS,娘的，我看哭了。PPS,推荐给所有的人看。PPPS,可以打十星吗？",拍电影是不是和做爱一样 只有技术做不出感情,这世界怪诞而疯狂、让人困惑，但好在我们还拥有友情
红辣椒,9.0,257584人评价,https://movie.douban.com/subject/1865703/,如果说盗梦空间像是工科生拍的 充满了逻辑 数学 推理 极尽聪明之事 那红辣椒就像是文科生拍的 天马行空 无所不能 是一个真正的梦,看完这个，我真的相信今敏是去过未来的人。他早就看过盗梦空间了，也经历了我们尚未经历的时代，到未来世界走了一圈，终于对人类失去了信心，所以选择离开。,出神入化的剪接切换、瑰丽多姿的色彩构图、天马行空光芒四射的巧妙构思……无不令人眼花缭乱、目不暇接、惊为天人、叹为观止！,“相对于深远的梦境来说，科学可能不过是一堆垃圾而已。” ,看不明白。
爱在黎明破晓前,8.8,393521人评价,https://movie.douban.com/subject/1296339/,你之前提到过以后几年的光景，一对夫妻会开始厌恶对方，对彼此的一举一动都了如指掌因此而感到厌烦，我想我会有相反的发展，我对一个人越是了解就越是能真正的去爱他，他会梳某种头发，他会穿哪件T恤，他在某种场合一定会讲的故事，我相信那会是我爱一个人最真实的境界。,全是对白的100分钟，能让你一点都不觉得沉闷，还泛起很多心思。当然是好片啦。,难得几乎全部是对白的影片让人看的这么过瘾！,河畔之诗：“浸入白日梦中的幻觉/ 眨动了密长的睫毛/ 哦，亲爱的，滑过你美丽的脸庞/ 在我的酒杯里坠入一滴清泪/ 凝视你纯净的双眸/ 了然了你是我生命的意义/ 仿佛奶昔在蛋糕的甜美中交融/ 我像那恍惚中浮现的天使/ 在梦幻中游戈飘荡/ 怎忍在看你芳心百转/ 却如何才能两情相悦…”,我所能想象的可以存在的最好的爱情啦~！
告白,8.7,518820人评价,https://movie.douban.com/subject/4268598/,都是你爸害的（《松子》），都是你妈逼的（《告白》），中岛哲也太喜欢成长阴影了吧……,等本片有下载的时候一定会有不少恶评，与以往的中岛哲也完全不同，大量的特写与高速慢镜的运用，全片好似分段式MV，情节上各种意识流似的拼贴。导演视乎在还原一种心理动作。谈不上非常喜欢，但却仍想赞一下。,"没有一人完全善，也没有一人完全恶。同情厌恶惊悚与快感最后一起炸裂，强烈震撼。
导演把黑暗绝望情节拍得如此娱乐好看，令人汗毛倒竖。",深い、重い、中国で上映できない,"一个打碎的瓶子粘合起来没有痕迹/
散发了的香气又钻回密封的瓶里/
撑开的伞合起来走失的人回到原地/
一场大雨往上逆向卷起云层大气/
旋转木马倒着旋转时针它走往童年方向/
我们回到无数个开始那些个年轻激烈的早上 "
一一,9.0,238474人评价,https://movie.douban.com/subject/1292434/,我这样说好了，你不在的时候，我有个机会去过了一段年轻时候的日子，本来以为我再活一次的话也许会有什么不一样，结果还是差不多，没什么不同。只是突然间觉得，再活一次的话，好像真的没那个必要。真的没那个必要……★★★★★★,杨德昌获嘎纳最佳导演奖的影片，近三个小时的影像细腻而漫长，其间没有大起大落，只是一直温和的诉说，可看这平淡的真实，却叫人沉重起来,如果电影都是过生活，那我们就过生活就好了,“电影发明以后，人类的生命至少比以前延长了三倍”，当我觉得自己已经看了两个小时，一拉进度条发现才过了三十几分钟的时候，我深刻地理解到了这句话,"看似平淡无奇,其实蕴含深意"
小森林 冬春篇,9.0,242758人评价,https://movie.douban.com/subject/25814707/,真希望变成晨间剧啊，每天都想看到,嗯，要细心，要有耐性，还要要守得住寂寞。当然首先，你要有块地。8.5,那种时光静静流走，不去叹息，也不挽留的感觉，真好,四季更替，万物轮回，小森的美不仅仅是体现在美食上。人与自然，相互给予，相互奉献。食物、耕作、生活，循环往复，生生不息，最妙的奥义尽在这小森之中了。,这妹子才是荒岛求生最佳技能王吧！
侧耳倾听,8.9,304947人评价,https://movie.douban.com/subject/1297052/,美则美矣 但是看着两个初中生这样子的深情 最后还说出你将来嫁给我这种话 还是觉得有点怪怪的 ,我喜欢男爵的爱情，喜欢钟表上永远不能相见的国王和王后。,最动人的一幕出现在爷爷拿着月岛刚完成的稚嫩的小说，对她说：太棒了，真是太棒了。在才华刚刚起步的日子里，有一个人能完全诚挚地赞美，比什么都好，它不会令人骄傲，相反会让人更看清自己。,我我...我，被两人青涩的爱情感动啦...在自己的生命里，会有那么一个激励自己想要走得快一点的人，为了能够赶上去，牵住他的手，不成为他的累赘，在背后支持着他，与他相爱，与她携手到老，实在是太美好了。, 细腻可爱的初恋故事如同少女写下的日记一般娓娓道来。侧耳倾听吧，那些呼唤着成长的微弱声音。
大鱼,8.8,399861人评价,https://movie.douban.com/subject/1291545/,"小王子说：“因为有一朵我们看不到的花儿，星星才显得如此美丽。沙漠之所以美丽，是因为沙漠的某处藏着一口井。”
波顿说：“他说故事，因为他无法忍受这无趣的地方。”这片子是献给在现实世界中迷失、畏首畏尾、丢失了童年时代欢愉梦想的人，那条游向远方的大鱼是我们对美的向往。",我怎么没有感动？因为我没有父亲。,靠编造故事度过平凡的一生的父亲，却在临终前依旧对自己在女巫的玻璃眼球中看见的河流耿耿于怀。他的儿子替他圆了这个“谎”，给了让父亲欣慰的答案。而父亲死后，他也成为他故事里的传奇。生命力极强的故事，天马行空的情节，最终却归于对平凡生活的抵抗。催泪。,感觉挺好，只是不大明白,似幻似真，此时没有真实或者不真实，只有你愿不愿意相信。
阳光姐妹淘,8.8,435362人评价,https://movie.douban.com/subject/4917726/,一起哭，一起笑，一起疯，一起闹，一起尽情折腾我们的人生，即使老去也有最美最好的青春可以一起祭奠。,泪水和欢笑可以同时绽放。2011最爱韩国电影。无悔的青春就是和你们一起范2傻笑打闹。我们是永远的好朋友好姐妹。,五星佳片！一部人生的缩影！,我以为那个最漂亮的姑娘长大以后会很惊艳什么的。,论跟土豪做好朋友的重要性。
蝙蝠侠：黑暗骑士崛起,8.7,487045人评价,https://movie.douban.com/subject/3395373/,孤立地看，这是一部无可争议的五星电影；但和第二部《黑暗骑士》比起来，它只能拿四颗星。,好看。但这么多明星都盖不住上一集中希思莱杰的光芒。部分场景令人联想到文革，并很明显的隐射了社会主义者与资本主义社会的矛盾。,难道我是第一个看的吗？墨尔本crown village cinema， 所有人都鼓掌了，绝对是今年最伟大的电影！,拍出了黑暗英雄的铁血丹心，但没能超越《黑暗骑士》。配乐超赞！,"贝恩真的太可怜了。。。。知道真相的瞬间我原谅了他做的所有坏事！老湿的眼睛真的会演戏！不戴面具的一秒镜头好帅 好虐 好凄美 好想哭！本以为这次我会改邪归正彻底爱上大蝙蝠，搞了半天我还是个悲催的反派控 。。。Goodbye, My Friend. 此去便是永别。（轻微吐槽：马良挂掉的那一下有点囧）"
射雕英雄传之东成西就,8.7,444640人评价,https://movie.douban.com/subject/1316510/,张学友让梁朝伟杀他那段，笑翻了,梁家辉和刘嘉玲是亮点，特别是后者，我简直被惊艳了,看看这部片，你会明白什么叫无厘头,刘镇伟哪里比王家卫差？！,跟同学一起又看了一遍，最喜欢刘嘉玲
唐伯虎点秋香,8.6,674787人评价,https://movie.douban.com/subject/1306249/,小时候看一次笑崩一次,"只为了“比比谁惨”那一段，就已是经典。
还有FLASH的经典《阴天》版，",N遍,周星驰鼎盛时期的电影没啥好说的！全五星好评！另外，还有彩蛋，萱萱有演秋香的侍女。,风华绝代的石榴姐，印象深刻。这种喜剧不适合巩皇，感觉变成花瓶了。
超脱,8.9,306770人评价,https://movie.douban.com/subject/5322596/,少年时，我们都自私无知，夸张那些伤痛来当作放纵的借口。只知依赖不知自救，只知索取不知珍惜。打架，滥交，还自以为是看透了生命，绝望的很酷，其实肤浅的令人发指。孩子，什么时候你开始沉默的承受加诸你身上的重量，尊重它并与它和平相处，你才真的能称为一个大写的人。,当电影全部播放完时，影院灯光亮起，那一刻我甚至觉得这个坐着千人的场子里的空气是凝结着的，每个人都很小心地呼吸着，被那绝望深深所震撼。,1 Brody演的太好了，人生导师和脆弱闷叔转换一念间；2 如果你施舍温暖，无家可归的人就必会依赖，“超脱”如何可能；3 对青少年的刻画犀利，但也许缺乏同情，我们无法知道他们为什么如此绝望冷漠而满不在乎；4 老师带着支离破碎的人生站在讲台上寻求权威和存在感，说不清工作和自我是否已经恶性循环,这部电影撩死了姐久违的厌世情绪（从值得褒奖的角度说的）。萝莉大叔之间的救赎之爱又很治愈，搞得姐要死不活（仍然是in good way）。个人风格非常强烈，影像形式非常自由，但信息传递得十分清晰。这很难得。姐真心觉得AB很帅的（好吧，我是马脸大叔爱好者），就是这长相注定演不了让人开心的电影,勿被片名误导。此片充满无处不在的郁抑及沉重。所有人对自己都毫无办法。指望他者解救自己的苦难永远只是一时，因他自顾尚且不暇。即使慈悲到收留你，也有天要离开。总之，就像那位代课教师一样，此片只是给了一个若即若离的拥抱，并未试图解决片中人物或观众的任何麻烦，但无助的人，会被无情击中。
倩女幽魂,8.7,478281人评价,https://movie.douban.com/subject/1297447/,這個聶小倩，爾等休想再超越！,飘逸写意中国古典，现在拍不出来也不愿拍,刚刚看完。电影一开始，旁边的一个女生就哭了。,好美的王祖賢～,此后心目中所有善良的女鬼都叫小倩
甜蜜蜜,8.8,350203人评价,https://movie.douban.com/subject/1305164/,其实是曾志伟的角色最令我动容。,重逢只要一瞬间，等待却像是一辈子。,这么多人都看哭了么。。。我就在张曼玉低头碰到喇叭那块儿眼红了下。。。这俩人的缘分太让人嫉妒了,黎小军连豹哥的一根头毛都比不上吧，嫁黎小军我一天能因为无聊自杀三百回，“无聊”这种东西如果能拟人的话，它的形象一定是黎明！！！,张曼玉精彩绝伦的演出成就了这部电影。聚散离合，缘起缘灭，情感的纹理与能量、生成与幻灭、真挚与虚妄，历史的荒诞与无情，一切的一切都是张曼玉。情到深处爆发出来的能量，如花瞬间绽放，充沛又从容，亚洲女星中大概唯有巅峰年代的高峰秀子可与之比肩。
驯龙高手,8.7,515801人评价,https://movie.douban.com/subject/2353023/,和谐的生活离不开摸头与被摸头,妙蛙种子龙。。呜哇,梦工厂会讲故事了...,虽然没有皮克斯那么有深度，故事情节也略显老套，但是好的电影就是能让观众沉浸其中，不管是用画面用音乐还是用其他的。错过档期没去电影院看3D只能说是一种遗憾，还好720p的效果也十分的赞，这应该是我今年到目前看过最好的一部动画片。★★★★☆,90分钟绝不冷场愉悦刺激的观影体验！3D技术的进步更是锦上添花~恰到好处的笑料，让人爱不释手的角色，精准传达的主题，精彩的动作场面，都是此片绝对值得推荐的理由。遗憾的是仍有缺陷，使影片仍算不上完美。
萤火之森,8.9,324177人评价,https://movie.douban.com/subject/5989818/,妖怪有颜就是治愈片 妖怪没有颜就是恐怖片,小孩子跑不好就不要跑好伐？！摔个什么摔！摔！,“总有一天，时间会把你我拆散吧，可是，即便如此，在那个时间到来之前，我们一直在一起吧”,最爱 没有之一 少女心都在这了,在那个夏天那片森林 拥抱你 离开你 记住你 就知道是死虐
恐怖直播,8.8,421288人评价,https://movie.douban.com/subject/21360417/,一个人怎么能成为国家公敌！结局是必然的  棒子能拍出这种电影让人震撼的 ps:韩国的电影审核制度真宽  这要是在天朝...哈哈,韩国电影中一直有一种东西，合适的时候叫『热血』，过量了就是『狗血』。但从来没见过不足的时候是什么样子。,一想到有生之年都无法参与这样的电影，忍不住呜呜哭了起来,河正宇的个人秀，他一个人撑起了这部低成本封闭空间，对媒体政客等各种讽刺黑出翔,故事敏感，扣人心弦；节奏紧凑，毫无尿点。又一场封闭空间里个人表演的精彩呈现，又一次感受韩国犯罪题材影片所带来的冲击与震撼。政治的阴暗、媒体的嘴脸，这些元素如此熟悉，然而每次出现都不会觉得厌倦。如果是你，将会作何选择？
菊次郎的夏天,8.8,342059人评价,https://movie.douban.com/subject/1293359/,奇怪，明明夏天总会有能烧焦皮肤的太阳，讨人厌的蚊虫，闷热的空气。但只要有一阵风吹过来，夏天就是一年中最好的季节。,而我只看到了深深的孤独，两个孩子的孤独。,矬大叔也有夏天,那种纯粹的感动与快乐.好久没有感受到了。,过强的风格化有损叙事部分的流畅度，但反而造就出一种非常奇特的空白效应，与人物的怪诞乖张相得益彰。久石让的配乐为影片增色不少，是一部非常有趣而诚挚的作品。
幸福终点站,8.8,363693人评价,https://movie.douban.com/subject/1292274/,我在维克多身上看到了阿甘的影子~~,太好看了，欢笑过后大大的感动。,“Viktor终于明白，这个世界不是按他自己的方式前进的；身处其中，只有为自己挣个好生活。” ,斯皮尔伯格为拍摄建造了一比一大小的航站楼 并作为商场。植入广告的客户入驻营业，广告费成为本片资金，逛商场的顾客成为数量庞大的群众演员。聪明的制片人。直到老师特地赞了一下结尾 关于空姐、爵士歌手的部分，才注意到结局蛮有命运生活的真实感。难得一部主角犯傻能逗乐我的片子。,故事很童话，主题很模糊。不知道是在讽刺制度太死板，还是歌颂工作人员对制度的努力维护。不知道是表现对纽约的自恋，还是批评“纽约不欢迎你”之不友善。不知道是把美国塑造成了各种族的庇护所，还是要体现阶级仇恨。不知道是在说生命的过程就是需要等待，还是在说不要傻傻等待而要果断行动。
爱在日落黄昏时,8.8,336980人评价,https://movie.douban.com/subject/1291990/,他为她写了本书，她为他写了首歌。其实，他们都记得，每个细节。这部就是来还愿的，又是一个开放式的结局。我想这次他们应该不会错过彼此了吧。,她瘦了。好爱她那件黑色小衫，后背开襟。只是从她拥抱他开始，眼泪就往下掉,最后的结尾，杰西坐在沙发上似笑非笑的看着塞林，他一定在想，这个女人太他妈可爱，可爱的想立即上了她，再娶她。,好的不得了的对白,这是我看过的关于男女相遇相爱最美好又最清醒的电影。
超能陆战队,8.7,665304人评价,https://movie.douban.com/subject/11026735/,好想戳爆胖子看会发生什么……,又是一个故事平平只靠细节讨巧的动画，但是没办法，就是超级吃这套啊！！,现在的动画都以卖萌为主题了，比如这里的大白，大概是一个萌熊的体验，或者是会移动的超大棉花糖，这也成为本片主要卖点。影片将迪士尼与漫威结合，人物设定与动作场面确实很漫威，很美漫超级英雄。而主题却还是迪士尼的亲情与成长之类的东西。斯坦李仍有客串，果然不放过每部漫威。,3.5 气球人真是很可爱，比那个贴胶布条的片段还要可爱！感觉短腿要开始流行了。但故事整个太模式化了，情感简单粗暴，感觉自己是婴儿，被喂了一套营养均衡的婴儿餐似的... 整个城市设定让人有点想看日语吹替版...,史上最萌胖子诞生！要抱抱！彩蛋里的斯坦·李也是蛮拼的！
无人知晓,9.1,174796人评价,https://movie.douban.com/subject/1292337/,家中早已经没有了妈妈，生活早已经很拮据，水电早已经停了，今天吃过的泡面汤要留作明天拌饭，喜爱画画就画在水电停用通知单上，从公园偷水饮用，把摔死的妹妹埋掉......这一切，都没有人知道,看完以后，也还是沉默，没有煽情的眼泪，没有明显的愤怒，就和这部电影一样，平静的说一个难过的故事，但没有一个人流泪，甚至连埋怨都没有。被抛弃真的很可怕。,真是可爱的孩子啊。从《距离》之后，是枝裕和的电影就越来越生活化，有些纪实的风格，琐碎的生活细节，两个小孩甚至算不上表演，即兴发挥的表演也让这部电影充满了生活气息。更难得的是，面对这种狗血的题材，是枝裕和却并没有煽情和大喊大叫，只是让所有角色一起忍耐、承受着，连同观众一起,埋葬妹妹时，黑暗中特写哥哥微微颤抖的手，那是一双12岁男孩的小手，它将土慢慢撒到箱子上。死亡的主题再次让人动容。真正理解的生命的人不会在死亡面前别过头去，真正勇敢的人即使在不断的失去中也能找到安顿自己生命的力量，但当这种坚韧出现在这些无人知晓的孩子身上的时候，却只让人感到生之残酷,唯一一部分了三次看完的电影，因为每次看都非常压抑，特别是在情绪很低落的最近。看完后很不舒服，真的很不舒服。我想我再也不想看第2次了。不想再忧心忡忡提心吊胆的看一部电影了。
借东西的小人阿莉埃蒂,8.8,361814人评价,https://movie.douban.com/subject/4202302/,“你永远在我心中，我永远都不会忘记你。”这是一部难得一见的富含诗意和伤感的动画片。细节和人设很棒，赏心悦目；配乐尤其出色，但叙事太过苍白匆忙。最后的轻轻告别，两人往后都会有自己人生，走自己的路，但曾经那段美好依旧会沉淀为一辈子的记忆。★★★★,我相信他们终有一天还会遇见的。,香港首映宫崎峻的借东西的小女孩亚利亚蒂。刚看完出来。观众在亮灯时仍然没人起身，一直到字幕结束。非常唯美，非常感人。我要去下ost。电影给六颗星。,吉卜力的动画里，总有个坚强的姑娘。最后送别时阿莉埃蒂摘下发卡，栗色的头发飘起来，她把它送给翔，说把它带在身边，翔微微睁大眼睛。我就是在这个时候，掉下了眼泪。阿莉埃蒂也掉下眼泪。一年多以来几乎没有什么戳中我泪点的电影。少女说“你保护了我，很开心。”而少年只是轻声呼唤着少女的名字。,她在他的手心，她在他的肩头，她在他的心间。感谢宫崎骏，感谢吉卜力，总是给我们纤尘不染的梦。
神偷奶爸,8.6,667899人评价,https://movie.douban.com/subject/3287562/,绝对史上top 5级别的动画片！！豆瓣评分不上9没天理,90/100。就冲着那个过山车你也得进一次电影院！小猫咪的睡前故事太萌了啊啊啊！！！,这个动画片再次证明了，不怕讲老故事，只需要有颗不老的心。打动人的是里面的小情趣，小可爱，小孤独，坚硬外表下谁都渴望一颗被温暖的心。真的远比toy3得我的心。,密集物恐惧症也不恐惧了 太可爱鸟！,"看到短短胖胖的小药丸， 就觉得好可爱，戈玛幼稚又充满希望的成熟让我心生怜爱。
^_^"
怪兽电力公司,8.7,432429人评价,https://movie.douban.com/subject/1291579/,kitty长得有点像姜文~,买了张蓝光碟，再次重看，画质优秀了，似乎离怪物们更近了，原来毛怪10年前的毛发就这么逼真了。再次感叹皮克斯的创意和想象力，最棒的地方也就是这个创意了，皮克斯的动画片过程可能都很相似，唯独创意个个都很独特。★★★★,您的尖叫就是俺的动力，收集能量的任意门！片尾的伪拍摄片花很有成龙喜剧的style。（|人：妖怪啊！|妖怪：人啊！|——摘自《东成西就》）,因为关心才吓人 ~好萌的怪物们 喜欢死了啊,皮克斯第四部长片，除了一炮而红的玩具总动员以及乘胜的二——以及成绩不佳的虫虫特工队之外的首个大收之作，阖家动画电影标本。
风之谷,8.9,270793人评价,https://movie.douban.com/subject/1291585/,不穿內褲的娜烏西卡公主。,细节：解开那个女孩衣服的时候看到了什么？,在此我们可以见到比卡丘的渊源，可以看到Spike飞船的渊源，可以看到虫师的渊源，也可以看到诸多动画人因此崛起的渊源。,"当女主角在黄金之海上复活的时候,我那发达的泪腺又西里哗啦了..",宫崎骏镜头下的美都是最自然、原始、野性的。设定大胆，配乐大气，可惜影院放的是英文吹替版= =。。。【豆瓣的大家！为什么都在讨论娜乌西卡有没有穿内裤呢！。。。
玩具总动员3,8.8,336076人评价,https://movie.douban.com/subject/1858711/,我87年出生，，看toy 1是小学3年级。看toy3是大学毕业。纯爷们，没哭死我。。。。我想说 这是皮克斯送给我们这代人的一份礼物。再见了，我的童年，谢谢你，皮克斯,前半部分就有好几次想哭的冲动，本来以为这次能够幸免的，没想到最后几分钟那么煽情，简直要哭死了。其实3D效果并没有很出色，但是精彩的剧本真的很让人感动。这不是一部给小孩子的动画，是一部给成人的童话。,结尾的煽情很见水准，但现实中哪里还找得到Andy这样单纯童真的17岁少年呢？！,竟然看动画片看到泪流不止。皮克斯，你真行。,"虽然是动画片，但没有一味地弘扬真善美，也反映了人性丑恶的一面。
比如抱抱熊罗素，它被替代了，它自己要走，还强行要别人也跟着离开。
胡迪救了它一命，它还恩将仇报。
除此之外，它还挑拨离间，企图让巴斯光年背叛朋友。
软的不行就来硬的，将巴斯光年恢复出厂设置，甚至提醒巴斯光年“当心它们对你用反间计”，太可怕了。
幼儿园充满黑暗和邪恶，连玩具也存在金字塔制度，分阶层和等级，有各种明争暗斗。
有卡车队伍巡逻..."
完美的世界,9.1,162669人评价,https://movie.douban.com/subject/1300992/,标准的好莱坞煽情之作，坏人的好总是比好人的好来得更感人~~,老牛仔真是个伟大的导演，总能把人性拍得如此美好而有力量。,哭了 小孩可爱，大叔也很会煽情，烂漫的骨子里还有一颗梦想的心,标准的有点像是教科书里的故事,我这辈子只杀过两个人，一个是伤害我妈妈的人，一个是伤害你的人。这个“你”却是仅仅相识一天的男孩。。同样缺失父爱的两人以这种方式依赖对方。特别安静特别可爱的男孩，以后也要给我孩子穿这样的连体衣！太萌了！
血战钢锯岭,8.7,552365人评价,https://movie.douban.com/subject/26325320/,以我有限的观影经验，优秀的战争片不会美化战场，不会粉饰死亡，不会矮化敌人，不会无视常识，最重要的，不会宣扬战争。这个片子基本都做到了。,队伍配置中奶妈的重要性,救人75命，胜造525级浮屠。,枪林弹雨过，片叶不沾身。信仰没能改变战争，但也没让战争改变自己。梅尔·吉布森的宗教狂热病和个人英雄主义都让我想BB，但因为有本命在闭着眼睛也要给五星啊～（只有加菲才能这么一脸阳光的面对杀戮和暴力，五好青年的笑容太美！！！）,李安想告诉我们英雄是会软弱会迷茫的平凡人，梅尔吉布森告诉我们英雄都是神一样的人。但是这部片的好处是，同样是展现人的神化，它可比手撕鬼子的剧真实多了。大概是因为真正的神从来不觉得自己所做的一切常人难以企及，他只是谦卑地认为自己做的还不够。克制是最大的美德。
